{
  "$schema": "../../../schemas/workstream.v1.schema.json",
  "schema_version": 1,
  "tracking_id": "MCP-F2-CORE-001",
  "title": "Official registered OAuth clients for Community resource publishing",
  "status": "completed",
  "milestone": "F2",
  "initial_owner": "Codex/01a12fd2-1e5d-7890-9d35-925436626eaa",
  "owner": "Codex/01a12fd2-1e5d-7890-9d35-925436626eaa",
  "started_at": "2026-10-13T04:47:49.632Z",
  "updated_at": "2026-10-13T05:07:40.505Z",
  "primary_repository": "mc-plan-core",
  "supporting_repositories": [
    "mc-plan-contracts",
    "mc-plan-ops"
  ],
  "reference_repositories": [
    "mc-plan-foundation",
    "mc-plan-community",
    "mc-plan-skin"
  ],
  "objective": "Deliver ADR0017 contract-first Core Developer App Community scope/audience prerequisite with independent PAT restrictions and real registered-client OAuth resource-chain evidence.",
  "in_scope": [
    "Corealpha.8 compatible declaration of existing Community delegatable scopes; PAT enum and realm reviewer/service restrictions unchanged",
    "Separate app/PAT validation catalogs; conditional Community audience, complete auxiliary-scope reconciliation, lifecycle failure compensation",
    "Ops local realm support and actual registered PKCE client acceptance through independent Core and Community APIs",
    "Both SDK generation/static/unit/pack/realHTTP gates, full Core producer gates, finalruntime image and localmain closure"
  ],
  "out_of_scope": [
    "Community/Skin/Foundation business edits, production deployment/remotepush or paid calls",
    "New moderator/admin policy, reward/pricing, productionobject/backup/retention decisions",
    "Claiming full F2/F3/F4 complete"
  ],
  "contract_impact": "Corealpha.8 compatible prerelease adds explicit existing resource:read/resource:write/upload:write Developer App delegation under caller ceiling. PAT enum unchanged; moderation:review and service permissions excluded. Contract-before-producer-before-SDK-before-Ops.",
  "acceptance_evidence": [
    "Full Core gates plus conditional audience/narrowing/complete reconciliation and failure/negative PAT tests",
    "Real Keycloak registered public PKCE client token through actual Core/Community HTTP resource lifecycle; narrowing/revocation enforced on new authorization",
    "BothSDK full declared checks/real smoke, Ops static/client lifecycle regression/new integration",
    "Canonicalruntime build, cleancommits, Finish and localmain"
  ],
  "repositories": {
    "mc-plan-core": {
      "base_commit": "9303cc62deeaa89fb07f77ba29a0b4f1b69457de",
      "branch": "feat/MCP-F2-CORE-001-community-oauth",
      "last_checkpoint_commit": "690193aafdcefafd2349389fd540caca109d95ce",
      "final_commit": "690193aafdcefafd2349389fd540caca109d95ce"
    },
    "mc-plan-contracts": {
      "base_commit": "17dde5423b419eb02e0e5721d5cff4df544e7e58",
      "branch": "feat/MCP-F2-CORE-001-community-oauth",
      "last_checkpoint_commit": "481cc85e3f2f86adef5d43af27c6d24ee1f42b30",
      "final_commit": "481cc85e3f2f86adef5d43af27c6d24ee1f42b30"
    },
    "mc-plan-ops": {
      "base_commit": "a0e78d7f923e5428a9576bdbc7b63d7b0f4fe3ae",
      "branch": "feat/MCP-F2-CORE-001-community-oauth",
      "last_checkpoint_commit": "415a1082bbbdbb22356482a49e2f1389eb5fd195",
      "final_commit": "415a1082bbbdbb22356482a49e2f1389eb5fd195"
    }
  },
  "depends_on": [
    "MCP-F2-FOUNDATION-003",
    "MCP-F2-COMMUNITY-002",
    "MCP-F1-CORE-012"
  ],
  "blocked_reason": null,
  "direction_exception": null,
  "handoff_history": [],
  "validation_results": [
    "Owner explicit whole-project module continuation and Core/Community priority; ADR0017 Accepted permits this bounded F2 prerequisite. All six worktrees clean and no active locks. Core current reconciliation misses missing auxiliary scopes; same expected-set helper must cover both producer provisioning and reconciliation. Earlier registration hit a missing empty active directory; only own empty branches were created then reverted, no business edits occurred. AllocateID and recreate coordinator directory inside the short transaction.",
    "Final producer/SDK/consumer/Ops acceptance all passed. Contractalpha.8lockebb00a6 committed before Core API sourcefb1bc07, finalCore690193a; Ops415a108. Corefull check:full passed121unit+86HTTPE2E+74real PostgreSQL/Keycloak integration, separately25contract=306; strict formatting/lint/typecheck,architecture85,existing8forwardmigrations/build passed. New immutable runtime mc-plan-core:mcp-f2-core-001-fb1bc07 sha256:2c9ee8fba75c79dbdabe904533bfe60bca340eb8e0fddb7d5b346b74fa389867. App scope catalog separate fromPAT; moderation/service/profile:write remainnondelegatable; conditional Community audience removed by narrowing; reconciliation now detects missing allauxiliaryscopes (oldblindspot fixed). Real Keycloak freshregisteredpublicPKCE token proves双audience/caller-approvedCommunityscopes/stableCoreID. Opsnew isolated Node acceptance passed fullactualCore+Community resource chain: signedPNG PUT/seal/version/pending, ordinaryclient403 and requestedscopecannotselfauthorize, realm-designatedhumanfixturedecisionAPI/byte-identicalinlinepreview/unpublish404, newtokenafter narrowing401 and newauthorizationafterrevocationrejected, UID1000bothruntimes,CoreDBlossready503live200/Communityprotected503. Onlysyntheticownerrole usesSQL; noSQLpublicationbypass. ExistingdevappKeycloak lifecycle regression onnewimage passed; Opsstatic/node--checkpassed. CoreSDKalpha.8still17methods37tests, bothgeneratedzero drift,strict/build/cleanpack/actualHTTP+Keycloakonnewimagepassed; CommunitySDK40tests/fullstatic/cleanpack/actualHTTPregressionpassed. Python20schema/3API/37ops+Redoclypassed,workspacepassed. Honestfirsttestiterationfailedonlynewfixturewrongrevokeverb;correctedtoexistingDELETEandfinalfullsuitepassed. Core/Skin APIshapesunchangedexceptdelegationcatalog; source-lockCommunityCorealpha.7consumerupgrade mustfollowseparateworkstream, nooutside-scopewrites. Evidence /Users/chenfeng/.codex/outputs/mc-core-oauth-20261013/. No migration/remotepush/paidcalls/productiondeploy; existingJWTrevocationwindowdocumented, noinstantJWTclaim. Allregisteredscopecomplete, Finish/localmainfollow."
  ]
}
