{
  "$schema": "../../../schemas/workstream.v1.schema.json",
  "schema_version": 1,
  "tracking_id": "MCP-GOV-FOUNDATION-001",
  "title": "建立 MC Plan 主方向与多仓协作治理",
  "status": "completed",
  "milestone": "GOV",
  "initial_owner": "MC Plan maintainer",
  "owner": "MC Plan maintainer",
  "started_at": "2026-09-30T20:08:25Z",
  "updated_at": "2026-10-01T00:21:37Z",
  "primary_repository": "mc-plan-foundation",
  "supporting_repositories": [],
  "reference_repositories": [
    "mc-plan-contracts",
    "mc-plan-core",
    "mc-plan-community",
    "mc-plan-skin",
    "mc-plan-ops"
  ],
  "objective": "建立唯一统筹中枢、强制工作流、动态项目注册表、开发路线和可同步 Skill。",
  "in_scope": [
    "Foundation 协调模型、标准、ADR、模板和校验脚本",
    "mc-plan-development Skill v1.1",
    "后续五个单仓开发路线工作流的统筹"
  ],
  "out_of_scope": [
    "产品 API、事件或 SDK 变更",
    "任何业务实现代码",
    "远程仓库创建或推送"
  ],
  "contract_impact": "none",
  "acceptance_evidence": [
    "The registry, current direction, active/completed workstream protocol, schemas and read-only validator are present and machine-validated",
    "Contracts, Core, Community, Skin and Ops each have a repository-specific development plan and enforced AGENTS preflight",
    "The coordination suite covers 14 normal, conflict, lifecycle, takeover and new-module cases",
    "mc-plan-development 1.1.0 passed structure and behavior validation and its user-level copy matches the Foundation authority",
    "The cross-tool session prompt names the authoritative Skill and requires one workstream at a time for Codex, GPT Work and Codely/GLM environments",
    "The next global direction is F1 / mc-plan-core in planned state behind the Foundation and Contracts human architecture review gate"
  ],
  "repositories": {
    "mc-plan-foundation": {
      "base_commit": "837444aea4357ad4c1f5fc851a3062ca7aa16b4d",
      "branch": "docs/MCP-GOV-FOUNDATION-001-coordination",
      "last_checkpoint_commit": "e0bf9d2e475aed3305f516e7de03611cb02c5ece",
      "final_commit": "e0bf9d2e475aed3305f516e7de03611cb02c5ece"
    }
  },
  "depends_on": [],
  "blocked_reason": null,
  "direction_exception": {
    "category": "foundation-governance",
    "authorized_by": "MC Plan owner via MCP-GOV implementation request",
    "reason": "Complete and validate the Foundation governance workstream after switching the next global direction to F1/Core."
  },
  "handoff_history": [],
  "validation_results": [
    "Coordination preflight passed for MCP-GOV-FOUNDATION-001",
    "Coordination validator tests passed: 14 cases",
    "Workspace validation passed for 6 active repositories, 96 Markdown files, and 25 JSON files",
    "Skill quick validation and 17 behavior cases passed",
    "Skill install, stale-copy rejection, backup replacement, and user-level version check passed",
    "Contract validation passed for 13 JSON schemas/events, 3 OpenAPI documents, and 15 operationIds",
    "Redocly validated all 3 OpenAPI documents"
  ]
}
