{
  "schema_version": 1,
  "tracking_id": "MCP-F4-CORE-001",
  "title": "Core admin read-only console face with apps/admin web and realm administrator acceptance",
  "status": "completed",
  "milestone": "F4",
  "initial_owner": "Codely/admin-console-20261013",
  "owner": "Codely/admin-console-20261013",
  "started_at": "2026-10-13T14:47:16.209012+08:00",
  "updated_at": "2026-10-14T12:31:14.7511300+00:00",
  "primary_repository": "mc-plan-core",
  "supporting_repositories": [
    "mc-plan-contracts",
    "mc-plan-ops"
  ],
  "reference_repositories": [
    "mc-plan-foundation",
    "mc-plan-community",
    "mc-plan-skin"
  ],
  "objective": "Deliver the ADR-0018 first admin-console slice: contract-first Core 0.1.0-alpha.9 read-only admin operations (admin:read), Core producer with scope+ADMIN-role+ACTIVE authorization, Ops realm-designated administrator with real acceptance and negatives, and the apps/admin PKCE web console for users/credits/entitlements/audit/outbox browsing.",
  "in_scope": [
    "Contracts: core.yaml 0.1.0-alpha.9 locks six read-only admin operations (listAdminUsers, getAdminUser, listAdminCreditLedger, listAdminEntitlementRecords, listAdminAuditRecords, listAdminOutboxRecords) under userOAuth scope admin:read with cursor pagination and field-closed schemas (no email/secret exposure); validate_contracts.py alpha.9 machine gates; SDK surface unchanged (17 operations, admin ops excluded until producer evidence)",
    "Core producer: src/admin module with AdminStore port plus Prisma implementation, authorization = admin:read scope plus ADMIN business role plus ACTIVE status, PAT catalog excludes admin:read (UNKNOWN_SCOPE), service tokens rejected; contract/unit/e2e/integration tests and full gates; contracts/core-api.lock.json updated to alpha.9",
    "Ops: realm admin:read client scope plus designated administrator user plus admin web PKCE client; validate-dev-environment.ps1 static gates; real-stack acceptance script covering administrator PKCE login and all six query surfaces plus labeled negatives (non-admin scope/role, PAT, service token)",
    "apps/admin Next.js workspace package in mc-plan-core: PKCE login, users list/search, user detail, credit ledger, entitlement records, audit log, outbox delivery status pages calling the REST API directly; browser e2e smoke"
  ],
  "out_of_scope": [
    "Any admin write operation (manual credit adjustment/refund exposure, PAT revocation, developer-app revocation, user status transitions) - deferred per ADR-0018 pending per-operation owner decisions and audit design",
    "Community moderation queue/dual-review/appeals and any Community/Skin business change; SDK exposure of admin operations; production deployment",
    "Q-010/Q-003/Q-013 decisions; price/legal/production values; claiming F2 or F4 complete"
  ],
  "contract_impact": "Core 0.1.0-alpha.9 adds six read-only admin operations under new userOAuth scope admin:read (realm-designated administrators only); existing 17 operations and all locked shapes unchanged; SDK surface unchanged until a later Contracts slice.",
  "acceptance_evidence": [
    "Core full gates green: unit/e2e/integration(real PostgreSQL)/contract vs locked alpha.9/architecture/migration/format/lint/typecheck/build",
    "Ops real-stack acceptance green: administrator PKCE login queries all six surfaces; labeled negatives (no-scope user, wrong role, PAT UNKNOWN_SCOPE, service token) rejected",
    "apps/admin browser e2e green against the real local stack (login + users + detail + ledger pages)",
    "Runtime image rebuilt and smoke-verified on the final tree"
  ],
  "repositories": {
    "mc-plan-core": {
      "base_commit": "690193aafdcefafd2349389fd540caca109d95ce",
      "branch": "feat/MCP-F4-CORE-001-admin-readonly-console",
      "last_checkpoint_commit": "06de705698f126a8eb462b828c7aaad16e992cbf",
      "final_commit": "06de705698f126a8eb462b828c7aaad16e992cbf"
    },
    "mc-plan-contracts": {
      "base_commit": "8090d8febe72fd3ad68812000184a31589b7fb5b",
      "branch": "feat/MCP-F4-CORE-001-admin-readonly-console",
      "last_checkpoint_commit": "b90a3b0007e9e45f5eb9316afd77a50dc2ebbd62",
      "final_commit": "b90a3b0007e9e45f5eb9316afd77a50dc2ebbd62"
    },
    "mc-plan-ops": {
      "base_commit": "415a1082bbbdbb22356482a49e2f1389eb5fd195",
      "branch": "feat/MCP-F4-CORE-001-admin-readonly-console",
      "last_checkpoint_commit": "ef00a72d89d312e35a80c33617eb6e4cbc5f2181",
      "final_commit": "ef00a72d89d312e35a80c33617eb6e4cbc5f2181"
    }
  },
  "depends_on": [
    "MCP-F2-FOUNDATION-005"
  ],
  "blocked_reason": null,
  "direction_exception": {
    "category": "foundation-governance",
    "authorized_by": "MC Plan project owner, explicit 2026-10-13 dispatch to complete the admin console with four same-day ask_user decisions (read-only-first; realm-designated users plus admin:read scope; apps/admin inside mc-plan-core; bounded F4-early opening), recorded in ADR-0018",
    "reason": "Bounded F4-early admin-console slice under the active F2 direction per ADR-0018: Core-domain read-only admin queries plus apps/admin web and Ops realm acceptance only; no F2 exit criteria claimed, no admin write operations, Q-010 undecided items untouched"
  },
  "handoff_history": [],
  "validation_results": [
    "Contracts lock: core.yaml 0.1.0-alpha.9 committed first (8f917bd, 16 files: 6 admin operations + admin:read scope + 11 field-closed schemas + validator gates + docs), then SDK regenerated at alpha.9 with SUPPORTED_OPERATIONS kept at 17 (b90a3b0; admin operations asserted absent, core.yaml sha pinned; SDK gates format/lint/typecheck/generate:check/test/build/pack:check all green). Core producer committed with admin module (AdminStore port + Prisma keyset store + cursor codec + controller triple authorization admin:read+ADMIN role+OIDC credential) and lock file at 25 files; gates green: unit 125, HTTP e2e 97, contract suite with 6 locked-schema admin validations, real-PostgreSQL integration 80, architecture, 8 migrations, format/lint/typecheck/build. apps/admin Next.js console (PKCE login + six read-only pages) built; browser e2e fixed (redirect host kept on the session-cookie origin, NODE_ENV=development for the dev server) and PASSED on the real stack: login -> users -> detail -> credit ledger round trip. Runtime image mc-plan-core:mcp-f4-core-001-29939a0 (ID ac3bbdd2bf46) built from the implementation tree. Ops: realm admin:read scope + mc-plan-admin role mapping + mc-plan-local-admin-web PKCE client; validate-dev-admin.ps1 ran two independent fresh-stack rounds ALL GREEN (real PKCE logins, six surfaces 200 with field-closed asserts, cursor continuation, 8 labeled negatives, identity 1:1:1 invariant, [SYNTHETIC-DB-SEED] role elevation + one consistent ledger fixture row honestly labeled); Playwright browser e2e green against the kept round-2 stack; static gate extended and passing.",
    "Final closure state: Core main 06de705 (implementation 336e278 + web app 29939a0 + docs 7c38dbe + web fix 06de705; 41 files +3763), Contracts main b90a3b0 (lock 8f917bd + SDK regen), Ops main ef00a72 (realm + validate-dev-admin.ps1 + static gate + runbook/docs); branches deleted, never on remote. Image mc-plan-core:mcp-f4-core-001-29939a0 (ID ac3bbdd2bf46) built from the implementation tree and exercised by two independent fresh-stack acceptance rounds plus the Playwright browser e2e (login -> users -> detail -> ledger). Admin write operations remain deferred per ADR-0018; Q-010 untouched; no F2/F4 completion claim. Direction exception honored under the owner 2026-10-13 admin-console dispatch while F2 stays active."
  ]
}
