{
  "$schema": "../../../schemas/workstream.v1.schema.json",
  "schema_version": 1,
  "tracking_id": "MCP-F1-FOUNDATION-006",
  "title": "按已完成的 CORE-002 校正组合状态与 Core 状态文档",
  "status": "completed",
  "milestone": "F1",
  "initial_owner": "Codely",
  "owner": "Codely",
  "started_at": "2026-10-02T23:09:01Z",
  "updated_at": "2026-10-02T23:20:30Z",
  "primary_repository": "mc-plan-foundation",
  "supporting_repositories": [
    "mc-plan-core"
  ],
  "reference_repositories": [
    "mc-plan-contracts",
    "mc-plan-community",
    "mc-plan-skin",
    "mc-plan-ops"
  ],
  "objective": "依据已完成、关闭并合并本地 main 的 MCP-F1-CORE-002，修正 Foundation 项目组合状态与 Core 状态/开发计划中的过期描述，为下一阶段 Developer App/scope/PAT 开发建立准确入口。",
  "in_scope": [
    "更新 Foundation memory/current/portfolio.md：准确记录 CORE-001 与 CORE-002 已完成、关闭并合并本地 main；Core 0.1.0-alpha.1 的身份/Profile 纵向链路已通过真实 Keycloak 开发组合验收；下一 Core 开发阶段为 Developer App、scope 和 PAT；当前唯一活动工作流为 MCP-F1-SKIN-008；Skin 的 Provider HTTP 402 已解除但 Finish 仍受所有者人工视觉验收阻塞",
    "更新 Core docs/STATUS.md：把 CORE-002 从进行中改为已完成，准确列出当前已实现边界与下一步",
    "更新 Core docs/development-plan.md：固定顺序第 3 步标记为完成，第 4 步标记为下一阶段",
    "修复 Foundation docs/STATUS.md 中关于 CORE-001 仍待协调关闭的同一事实过期描述",
    "核对 direction.json；仅在真实状态需要时更新时间或说明，不改变 F1 主方向与退出条件",
    "检查相关交叉引用、日期、工作流数量和里程碑描述，修复同一事实的明显矛盾"
  ],
  "out_of_scope": [
    "实现 Developer App、scope、PAT 或任何业务代码",
    "修改 OpenAPI、JSON Schema、事件、SDK 或契约版本",
    "修改 mc-plan-contracts、mc-plan-ops、mc-plan-skin、mc-plan-community",
    "决定 PAT 默认最长有效期、正式 scope 集合或其他尚未批准的产品/安全政策",
    "创建远程仓库、推送或部署",
    "触碰 MCP-F1-SKIN-008 的分支、记录或运行环境"
  ],
  "contract_impact": "none; documentation-only status correction with no public interface, schema, event or SDK change",
  "acceptance_evidence": [
    "协调 Start、Continue、Finish 校验全部通过",
    "Foundation 工作区、协调、Markdown 链接、JSON、Skill、命名和跨仓一致性校验通过",
    "Core 按 AGENTS.md 声明的验收命令实际执行并记录结果；因纯文档修改而不适用的项明确记录原因",
    "六仓职责、活动锁数量、工作流编号与 Git 状态一致；Skin 工作流保持原样"
  ],
  "repositories": {
    "mc-plan-foundation": {
      "base_commit": "d5112e3584d6c9a16c086dc503b0c0b8384baf5f",
      "branch": "docs/MCP-F1-FOUNDATION-006-status-correction",
      "last_checkpoint_commit": "38463b79a03124fab5c0223a43b0d14df370fac3",
      "final_commit": "08c0c08cac2f6bdaa86befcfdf2a2b2eecab0907"
    },
    "mc-plan-core": {
      "base_commit": "30382fd34ff7c67da978358fc247c05221bddb22",
      "branch": "docs/MCP-F1-FOUNDATION-006-status-correction",
      "last_checkpoint_commit": "b684ac88f5a07dd261844993e794b6a8d98e6a75",
      "final_commit": "b684ac88f5a07dd261844993e794b6a8d98e6a75"
    }
  },
  "depends_on": [
    "MCP-F1-CORE-002"
  ],
  "blocked_reason": null,
  "direction_exception": {
    "category": "foundation-governance",
    "authorized_by": "MC Plan project owner via the dispatch prompt authorizing this bounded documentation-governance workstream (2026-10-03)",
    "reason": "Foundation-primary governance correction that records the completed MCP-F1-CORE-002 status facts; it preserves mc-plan-core as the F1 primary product direction, changes no public contract or business code, and takes over no other workstream."
  },
  "handoff_history": [],
  "validation_results": [
    "Canonical mc-plan-development 1.1.2 and mc-plan-orchestrator 1.0.0 matched their installed user-level copies via install.ps1 -Check",
    "Preflight verified the snapshot live: direction F1 with primary mc-plan-core; the only other active workstream MCP-F1-SKIN-008 locks only mc-plan-skin; six worktrees clean with no remotes; Foundation main d5112e3584d6c9a16c086dc503b0c0b8384baf5f, Core main 30382fd34ff7c67da978358fc247c05221bddb22, Contracts main 070b00ae27bda4c3ec2d5cdd08cece626c8878a7, Ops main ff0eeb7ff61301af762ba05ab58459b6c707577e; CORE-002 final commits are reachable from local mains with its short-lived branches already deleted; FOUNDATION-004 and FOUNDATION-005 exist in completed and were not reused; MCP-F1-FOUNDATION-006 was confirmed as the next unused Foundation number",
    "Coordination Start passed with Foundation as primary, Core as the only supporting repository, and the independent Skin-only lock unchanged",
    "Core docs correction committed on its branch: STATUS.md marks the identity slice complete with the implemented boundary and the Developer App/scope/PAT next step (c73705b), and development-plan.md marks fixed-order step 3 complete and step 4 as the next phase (b684ac8)",
    "Foundation portfolio.md committed as e524244 records CORE-001 and CORE-002 completed, closed and merged to local main, the 0.1.0-alpha.1 identity/Profile chain accepted through the real Keycloak development combination, Developer App/scope/PAT as the next Core phase, MCP-F1-SKIN-008 as the only active workstream, and the resolved Skin HTTP 402 with the remaining manual-visual-acceptance blocker; docs/STATUS.md committed as 38463b7 aligns the same facts",
    "direction.json was reviewed and intentionally left unchanged: its F1 milestone, mc-plan-core primary, entry gate, exit criteria, allowed supporting repositories and Skin restricted preparation contain no stale CORE-002 status fact, so no time or wording update was needed",
    "Foundation validate-workspace.ps1 passed for 6 active repositories, 111 Markdown files and 41 JSON files (workspace structure, Markdown local links, JSON Schema ids, contract references, Skill frontmatter and coordination validation)",
    "Foundation test-coordination.ps1 passed all 14 coordination regression cases in its isolated .validation fixture",
    "Coordination Continue passed with Foundation as primary, Core as the only supporting repository, and the independent Skin-only lock unchanged",
    "Core pnpm lint passed with zero findings; pnpm typecheck passed; pnpm test:unit passed 21/21; pnpm test:e2e passed 7/7; pnpm test:architecture passed for 24 source files; pnpm migration:validate passed for 2 forward-only migrations; pnpm build passed; Docker is available so pnpm test:integration passed 2/2 on isolated PostgreSQL containers",
    "Core pnpm format:check FAILED on 23 files because of a pre-existing machine-state conflict, not this change: core.autocrlf=true stores LF but checks out CRLF while Prettier enforces LF; 21 of the flagged files are untouched by this workstream and a fresh git worktree of base commit 30382fd fails identically, proving the condition predates this workflow; the two files edited by this workstream were normalized to LF on disk and now pass Prettier individually",
    "Core pnpm test:contract with MC_PLAN_CONTRACTS_DIR=..\\mc-plan-contracts FAILED with contract drift on openapi/core.yaml for the same CRLF reason on the read-only Contracts worktree: byte-level comparison proves all 5 locked files at Contracts 070b00a still hash exactly to the locked digests after LF normalization (3f7cea25... for openapi/core.yaml and 4 more MATCHes), so there is zero contract content drift",
    "Supplementary Core contract verification against a byte-faithful LF extraction (git -c core.autocrlf=false archive) of the locked Contracts commit 070b00ae27bda4c3ec2d5cdd08cece626c8878a7 passed completely: verify-contracts accepted 5 files at 0.1.0-alpha.1 and the contract vitest suite passed 1/1; no read-only repository was modified",
    "Core docker build --target runtime was executed as additional evidence even though a docs-only change involves no container source; it completed successfully with exit 0 and exported the runtime image (manifest sha256:1b86cac98aadd6376613da890ed5a70438710bf88b7f6c42cbe46ddc83bf1e13)",
    "Six-repository consistency confirmed: Foundation and Core on their FOUNDATION-006 branches with clean trees, Contracts/Community/Ops clean on main at 070b00a/69ac5e9f/ff0eeb7, no remotes anywhere, Skin untouched by this workstream on its own locked branch feat/MCP-F1-SKIN-008-pixel-blueprint-v4",
    "Final commits recorded as Foundation 08c0c08cac2f6bdaa86befcfdf2a2b2eecab0907 and Core b684ac88f5a07dd261844993e794b6a8d98e6a75; no repository outside the declared Foundation-primary and Core-supporting scope was written, and the Skin workstream branch, record and runtime were left untouched"
  ]
}
